<?xml version="1.0" ?>
<?xml-stylesheet type="text/xsl" href="familytree relational.xsl"?>
<!DOCTYPE familytree SYSTEM "C:\Users\xce35l0\IntelliJ\Stammbaum\Implementierung\familytree relational.dtd">
<familytree>
    <person pid="0" forename="Daniel" surname="Brown" birthdate="27.09.1994" sex="M"/>
    <person pid="1" forename="Micha" surname="Piertzik" birthdate="09.01.1996" sex="M"/>
    <person pid="2" forename="Chiara" surname="Armbruster" birthdate="29.04.1996" sex="F"/>
    <person pid="3" forename="Opa" surname="Mustermann" sex="M">LOL</person>
    <person pid="4" forename="Oma" surname="Mustermann" sex="F"/>
    <person pid="5" forename="Max" surname="Mustermann" sex="M"/>
    <person pid="6" forename="Maria" surname="Mustermann" sex="F"/>
    <person pid="7" forename="Sohn" surname="Mustermann" sex="M"/>
    <family parent1="3" parent2="4" children="5">Lol</family>
    <family parent1="5" parent2="6" children="243">Lol</family>
</familytree>